{
  "format": "contextpack",
  "format_version": "0.1",
  "manifest": {
    "generator": "contextport-synthetic-fixture",
    "generator_version": "0.1",
    "created_at": "2026-07-11T00:00:00Z",
    "privacy": "synthetic",
    "source": {
      "system": "synthetic-assistant",
      "artifact_ref": "fixture://source/export-001",
      "artifact_sha256": "aaaaaaaaaaaaaaaaaaaaaaaaaaaaaaaaaaaaaaaaaaaaaaaaaaaaaaaaaaaaaaaa"
    }
  },
  "projects": [
    {
      "id": "project-001",
      "source_ref": "source-project-001",
      "title": "Synthetic Garden Plan"
    }
  ],
  "conversations": [
    {
      "id": "conversation-001",
      "source_ref": "source-conversation-001",
      "project_id": "project-001",
      "title": "Synthetic Seed List",
      "ordinal": 0
    }
  ],
  "messages": [
    {
      "id": "message-001",
      "source_ref": "source-message-001",
      "conversation_id": "conversation-001",
      "role": "user",
      "ordinal": 0,
      "content": [
        {
          "kind": "text",
          "source_ref": "source-message-001-block-001",
          "ordinal": 0,
          "text": "List three fictional blue flowers.",
          "sha256": "4dd5becbb038489781a13a1e23865356e1e162a0d849169a010d70bd9d08bfa8"
        }
      ]
    },
    {
      "id": "message-002",
      "source_ref": "source-message-002",
      "conversation_id": "conversation-001",
      "role": "assistant",
      "ordinal": 1,
      "content": [
        {
          "kind": "unknown",
          "source_ref": "source-message-002-block-001",
          "ordinal": 0,
          "reason": "Synthetic source block type is intentionally unsupported.",
          "raw": {"synthetic_type": "imaginary-widget"}
        }
      ]
    }
  ],
  "attachments": [],
  "transformations": [],
  "dispositions": [
    {
      "source_ref": "source-project-001",
      "item_type": "project",
      "status": "copied"
    },
    {
      "source_ref": "source-conversation-001",
      "item_type": "conversation",
      "status": "copied"
    },
    {
      "source_ref": "source-message-001",
      "item_type": "message",
      "status": "copied"
    },
    {
      "source_ref": "source-message-001-block-001",
      "item_type": "content_block",
      "status": "copied"
    },
    {
      "source_ref": "source-message-002",
      "item_type": "message",
      "status": "copied"
    },
    {
      "source_ref": "source-message-002-block-001",
      "item_type": "content_block",
      "status": "unsupported",
      "reason": "Synthetic source block type is not represented by ContextPack 0.1."
    }
  ]
}
